{
  "schema_version": "0.5.0",
  "command": "recover",
  "mode": "balanced",
  "source": {
    "canonical_path": "/external/example.pst",
    "device": 1,
    "inode": 2,
    "size_bytes": 4096,
    "modified_at": "2026-07-20T00:00:00Z",
    "sha256": "aaaaaaaaaaaaaaaaaaaaaaaaaaaaaaaaaaaaaaaaaaaaaaaaaaaaaaaaaaaaaaaa"
  },
  "job_directory": "/output/example-job",
  "normal_items": 8,
  "recovered_items": 1,
  "orphan_items": 0,
  "fragment_items": 0,
  "committed_candidates": 9,
  "complete_candidates": 9,
  "partial_candidates": 0,
  "unsupported_candidates": 0,
  "blob_count": 4,
  "blob_bytes": 3584,
  "issues": 0,
  "issues_dropped": 0,
  "worker_attempts": 1,
  "worker_failures": 0,
  "isolated_units": 0,
  "peak_worker_rss_bytes": 67108864,
  "interrupted": false,
  "source_unchanged": true
}
